{
  "schema": "blueprint-to-code.harvest-runtime-observation/v2",
  "observationSetId": "runtime://example/replace-before-use",
  "synthetic": true,
  "environment": {
    "gameBuild": "REPLACE_WITH_RECORDED_BUILD",
    "serverSettings": {
      "HarvestAmountMultiplier": 1.0
    },
    "mods": [],
    "map": "REPLACE_WITH_RECORDED_MAP",
    "notes": "Synthetic field template only. This is not a real measurement."
  },
  "subject": {
    "nodeId": "REPLACE_WITH_EXACT_NODE_ID",
    "nodeResourceId": "REPLACE_WITH_EXACT_NODE_RESOURCE_ID",
    "speciesKey": "replace-with-exact-species-key",
    "creatureObjectPath": "/Game/REPLACE/WITH/EXACT/Creature.Creature_C",
    "attackIndex": 0
  },
  "staticModel": {
    "modelVersion": "harvest-estimated-yield-per-node/v1-native-static-profile",
    "extractorVersion": "REPLACE_WITH_EXTRACTOR_VERSION",
    "policyVersion": "harvest-ranking-policy/v2-confirmed-canonical-relative-specialty",
    "nodeCatalogRevision": "0000000000000000000000000000000000000000000000000000000000000000",
    "evaluationCatalogRevision": "0000000000000000000000000000000000000000000000000000000000000000",
    "componentCatalogRevision": "0000000000000000000000000000000000000000000000000000000000000000"
  },
  "trials": [
    {
      "trialId": "replace-with-real-trial-id",
      "durationSeconds": 1.0,
      "hits": [],
      "finalResourceUnits": 0.0
    }
  ]
}
